PaperID,CatID,CatID2,CatID3,CatID4,CatID_gen,Authors,Title,Location,PublicationType,PublishedDateMonth,PublishedDateYear,PDFLink,LocalPDFLink,PSLink,Abstract,RegisterDate,sortOrder,ProjectLink,OtherAuthors
73,6,9,6,6,NULL,"C. Bajaj, V. Pascucci, G. Zhuang",Progressive Compression and Transmission of Arbitrary Triangular Meshes,"In Proceedings of the 10th IEEE Visualization 1999 Conference, October 24-29, 1999. San Francisco, CA, pp. 307 - 316.",Conference Presentations & Publications,0,1999,http://ieeexplore.ieee.org/iel5/6578/17553/00809902.pdf?isnumber=17553&prod=CNF&arnumber=809902&arSt=307&ared=537&arAuthor=Bajaj%2C+C.L.%3B+Pascucci%2C+V.%3B+Zhuang%2C+G.,http://cvcweb.ices.utexas.edu/cvc/papers/1999/conference/00809902.pdf,http://cvcweb.ices.utexas.edu/cvc/papers/1999/conference/Cpm-all.ps,,12/4/2006 14:49,900,,"(with V. Pascucci, G. Zhuang)"
74,4,4,4,4,NULL,"C. Bajaj, V. Pascucci, D.Thompson, X. Zhang",Parallel Accelerated Isocontouring for Out-of-Core Visualization,"In Proceedings of the 1999 IEEE Symposium on Parallel Visualization and Graphics, October 24-29, 1999, San Francisco, CA, pp. 97-104.",Conference Presentations & Publications,0,1999,http://ieeexplore.ieee.org/iel5/6587/17584/00810144.pdf?isnumber=17584&prod=CNF&arnumber=810144&arSt=97&ared=122&arAuthor=Bajaj%2C+C.L.%3B+Pascucci%2C+V.%3B+Thompson%2C+D.%3B+Zhang%2C+X.Y.,http://cvcweb.ices.utexas.edu/cvc/papers/1999/conference/00810144.pdf,http://cvcweb.ices.utexas.edu/cvc/papers/1999/conference/papera1.ps,,12/4/2006 14:48,900,NULL,"(with V. Pascucci, D.Thompson, X. Zhang)"
75,5,7,5,5,NULL,"C. Bajaj, I. Ihm, S. Park",Making 3D Textures Practical,"In Proceedings of Pacific Graphics, October 5-7, 1999, Seoul, Korea, Pages 259-268.",Conference Presentations & Publications,0,1999,http://doi.ieeecomputersociety.org/10.1109/PCCGA.1999.803370,http://cvcweb.ices.utexas.edu/cvc/papers/1999/conference/ihm-textures.pdf,http://cvcweb.ices.utexas.edu/cvc/papers/1999/conference/ihm-textures.ps,,12/4/2006 14:30,900,NULL,"(with I. Ihm, S. Park)"
76,6,9,6,6,NULL,"C. Bajaj, V. Pascucci, G. Zhuang",Single Resolution Compression of Arbitrary Triangular Meshes with Properties,"Data Compression Conference 1999. Snowbird, Utah. Pages 247-256.",Conference Presentations & Publications,0,1999,http://ieeexplore.ieee.org/iel5/6126/16375/00755674.pdf?isnumber=16375&prod=CNF&arnumber=755674&arSt=247&ared=256&arAuthor=Bajaj%2C+C.L.%3B+Pascucci%2C+V.%3B+Zhuang%2C+G.,http://cvcweb.ices.utexas.edu/cvc/papers/1999/conference/00755674.pdf,http://cvcweb.ices.utexas.edu/cvc/papers/1999/journal/comgeo364.ps,,12/4/2006 14:49,900,NULL,"(with V. Pascucci, G. Zhuang)"
77,3,3,3,3,NULL,"C. Bajaj, G. Xu",Regular Algebraic Curve Segments (III) - Applications In Interactive Design And Data Fitting,TICAM Technical Report #99-34.,Technical Reports,0,1999,http://cvcweb.ices.utexas.edu/cvc/papers/1999/techreports/cagd99.pdf,http://cvcweb.ices.utexas.edu/cvc/papers/1999/techreports/cagd99.pdf,http://cvcweb.ices.utexas.edu/cvc/papers/1999/techreports/cagd99.ps,,12/4/2006 14:14,800,NULL,(with G. Xu)
78,5,5,5,5,NULL,"C. Bajaj, V. Pascucci, D. Schikore",Seed Sets and Search Structures for Optimal Isocountour Extraction,TICAM Technical Report #99-35.,Technical Reports,0,1999,http://cvcweb.ices.utexas.edu/cvc/papers/1999/techreports/cont-tog.pdf,http://cvcweb.ices.utexas.edu/cvc/papers/1999/techreports/cont-tog.pdf,http://cvcweb.ices.utexas.edu/cvc/papers/1999/techreports/cont-tog.ps,,12/4/2006 14:48,800,NULL,"(with V. Pascucci, D. Schikore)"
79,5,5,5,5,NULL,"C. Bajaj, V. Pascucci",Progressive IsoContouring,TICAM Technical Report #99-36.,Technical Reports,0,1999,http://cvcweb.ices.utexas.edu/cvc/papers/1999/techreports/prog-iso.pdf,http://cvcweb.ices.utexas.edu/cvc/papers/1999/techreports/prog-iso.pdf,http://cvcweb.ices.utexas.edu/cvc/papers/1999/techreports/prog-iso.ps,,12/4/2006 14:47,800,NULL,(with V. Pascucci)
80,5,5,5,5,NULL,"B. Duerstock, C. Bajaj, V. Pascucci, D. Schikore. K. Lin, R. Borgens",Three-Dimensional Imaging of the Experimental Spinal Cord Injury,TICAM Technical Report #99-37.,Technical Reports,0,1999,http://cvcweb.ices.utexas.edu/cvc/papers/1999/techreports/scipaper.pdf,http://cvcweb.ices.utexas.edu/cvc/papers/1999/techreports/scipaper.pdf,http://cvcweb.ices.utexas.edu/cvc/papers/1999/techreports/SCIpaper.ps,,12/4/2006 14:02,800,NULL,"(with B. Duerstock, V. Pascucci, D. Schikore. K. Lin, R. Borgens)"
81,5,5,5,5,NULL,"C. Bajaj, V. Pascucci, R. Holt, A. Netravali",Active Contouring of Images with Physical A-Splines,TICAM Technical Report #99-03.,Technical Reports,0,1999,http://cvcweb.ices.utexas.edu/cvc/papers/1999/techreports/aic.pdf,http://cvcweb.ices.utexas.edu/cvc/papers/1999/techreports/aic.pdf,http://cvcweb.ices.utexas.edu/cvc/papers/1999/techreports/aic.ps,,12/4/2006 14:49,800,NULL,"(with V. Pascucci, R. Holt, A. Netravali)"
82,3,3,3,3,NULL,"G. Xu, H. Huang, C. Bajaj",C1 Modeling with A-patches from Rational Trivariate Functions,TICAM Technical Report #99-04.,Technical Reports,0,1999,http://cvcweb.ices.utexas.edu/cvc/papers/1999/techreports/rpatch.pdf,http://cvcweb.ices.utexas.edu/cvc/papers/1999/techreports/rpatch.pdf,http://cvcweb.ices.utexas.edu/cvc/papers/1999/techreports/rpatch.ps,,12/4/2006 14:55,800,NULL,"(with G. Xu, H. Huang)"
83,3,3,3,3,NULL,"C. Bajaj, G. Xu",Smooth Reconstruction and Deformation of Free-Form Fat Surfaces,TICAM Technical Report #99-08.,Technical Reports,0,1999,http://cvcweb.ices.utexas.edu/cvc/papers/1999/techreports/tog.pdf,http://cvcweb.ices.utexas.edu/cvc/papers/1999/techreports/tog.pdf,http://cvcweb.ices.utexas.edu/cvc/papers/1999/techreports/tog.ps,,9/19/2016 15:56,800,NULL,(with G. Xu)
84,6,6,6,6,NULL,"C. Bajaj, V. Pascucci, A. Shamir, R. Holt, A. Netravali",Multiresolution Molecular Shapes,TICAM Technical Report #99-42.,Technical Reports,0,1999,http://cvcweb.ices.utexas.edu/cvc/papers/1999/techreports/mol00.pdf,http://cvcweb.ices.utexas.edu/cvc/papers/1999/techreports/mol00.pdf,http://cvcweb.ices.utexas.edu/cvc/papers/1999/techreports/mol00.ps,,12/4/2006 14:48,800,NULL,"(with V. Pascucci, A. Shamir, R. Holt, A. Netravali)"
85,3,6,3,3,NULL,"C. Bajaj, R. Holt, A. Netravali",Rational Parameterizations of Nonsingular Real Cubic Surfaces,"ACM Transactions on Graphics, 17, 1, (1998), 1-31",Journal Publications,0,1998,http://portal.acm.org/ft_gateway.cfm?id=269800&type=pdf&coll=portal&dl=ACM&CFID=71943300&CFTOKEN=29877204,http://cvcweb.ices.utexas.edu/cvc/papers/1998/journal/p1-bajaj.pdf,http://cvcweb.ices.utexas.edu/cvc/papers/1998/journal/cubictog.ps,,12/4/2006 14:43,1000,NULL,"(with R. Holt, A. Netravali)"
86,6,6,6,6,NULL,"C. Bajaj, E. Sacks",Sliced Configuration Spaces for Curved Planar Bodies,"International Journal Of Robotics Research, 17, 6, (1998), 639-651.",Journal Publications,0,1998,http://cvcweb.ices.utexas.edu/cvc/papers/1998/journal/slices.pdf,http://cvcweb.ices.utexas.edu/cvc/papers/1998/journal/slices.pdf,http://cvcweb.ices.utexas.edu/cvc/papers/1998/journal/slices.ps,,12/4/2006 14:11,1000,NULL,(with E. Sacks)
87,5,7,5,5,NULL,"L. Moriarty, B. Duerstock, C. Bajaj, K. Lin, R. Borgens",Two and Three Dimensional Computer Graphics Evaluation of the Subacute Spinal Cord Injury,"Journal of Neurological Sciences, vol. 155, pp 121-137 (1998), http://tinyurl.com/PMID9562256, PMID: 9562256, PMC Journal in Process).",Journal Publications,0,1998,http://www.sciencedirect.com/science?_ob=MImg&_imagekey=B6T06-3S7XKPX-1-T&_cdi=4854&_user=108429&_orig=browse&_coverDate=03%2F05%2F1998&_sk=998449997&view=c&wchp=dGLbVzb-zSkzV&md5=5504acf2f6d70f2646d8ee07f5958b1f&ie=/sdarticle.pdf,http://cvcweb.ices.utexas.edu/cvc/papers/1998/journal/sdarticle02.pdf,,,2/12/2010 17:23,1000,,"(with L. Moriarty, B. Duerstock, K. Lin, R. Borgens)"
88,4,6,7,9,NULL,"C. Bajaj, D. Schikore",Topology Preserving Data Simplification with Error Bounds,"Journal on Computers and Graphics, vol. 22.1, pp. 3-12, 1998.",Journal Publications,0,1998,http://www.sciencedirect.com/science?_ob=MImg&_imagekey=B6TYG-3V6YCXT-1-1F&_cdi=5618&_user=108429&_orig=browse&_coverDate=02%2F25%2F1998&_sk=999779998&view=c&wchp=dGLzVzz-zSkzk&md5=e0f2e315ae7a60c4a085a8e8c9e3c299&ie=/sdarticle.pdf,http://cvcweb.ices.utexas.edu/cvc/papers/1998/journal/sdarticle01.pdf,,,12/4/2006 14:11,1000,NULL,(with D. Schikore)
89,3,11,11,11,NULL,"C. Bajaj, J. Bloomenthal, J. Blinn, M. Gascuel, A. Rockwood, B. Wyvill, G. Wyvill",Introduction to Implicit Surfaces,"Morgan Kaufman Publishers Inc., (1997).",Edited Books,0,1997,,NULL,,,12/4/2006 14:33,700,NULL,"(with J. Bloomenthal, J. Blinn, M. Gascuel, A. Rockwood, B. Wyvill, G. Wyvill)"
90,4,5,10,5,11,C. Bajaj,Visualization Paradigms,"Data Visualization Techniques, edited by C. Bajaj, John Wiley and Sons (1998).",Book Chapters,0,1998,http://cvcweb.ices.utexas.edu/cvc/papers/1998/conference/ch1.pdf,http://cvcweb.ices.utexas.edu/cvc/papers/1998/conference/ch1.pdf,http://cvcweb.ices.utexas.edu/cvc/papers/1998/conference/ch1.ps,,12/14/2015 17:49,950,NULL,NULL
91,4,5,6,10,11,"C. Bajaj, V. Pascucci, D. Schikore",Accelerated IsoContouring of Scalar Fields,"Data Visualization Techniques, edited by C. Bajaj, John Wiley and Sons (1998).",Book Chapters,0,1998,http://cvcweb.ices.utexas.edu/cvc/papers/1998/conference/ch3.pdf,http://cvcweb.ices.utexas.edu/cvc/papers/1998/conference/ch3.pdf,http://cvcweb.ices.utexas.edu/cvc/papers/1998/conference/ch3.ps,,12/14/2015 17:49,950,NULL,"(with V. Pascucci, D. Schikore)"
93,4,6,6,6,NULL,"C. Bajaj, V. Pascucci, R. Holt, A. Netravali",Dynamic Maintenance and Visualization of Molecular Surfaces,"Proceedings of the Tenth Canadian Conference on Computational Geometry, August 1998.",Conference Presentations & Publications,0,1998,,http://cvcweb.ices.utexas.edu/cvc/papers/2003/journal/sdarticle03.pdf,http://www.cccg.ca/proceedings/1998/cccg98-bajaj-dynamic.ps.gz,,12/4/2006 14:49,900,NULL,"(with V. Pascucci, R. Holt, A. Netravali)"
94,4,5,4,4,NULL,"C. Bajaj, V. Pascucci, G. Ribbiolo, D. Schikore",Hypervolume Visualization: A Challenge in Simplicity,"Proceeding of the IEEE/ACM 1998 Symposium on Volume Visualization pages 95-102 October 1998, Research Triangle Park, NC.",Conference Presentations & Publications,0,1998,http://ieeexplore.ieee.org/iel4/5903/15742/00729590.pdf?isnumber=15742&prod=CNF&arnumber=729590&arSt=95&ared=102%2C+172&arAuthor=Bajaj%2C+C.L.%3B+Pascucci%2C+V.%3B+Rabbiolo%2C+G.%3B+Schikore%2C+D.R.,http://cvcweb.ices.utexas.edu/cvc/papers/1998/conference/00729590.pdf,http://cvcweb.ices.utexas.edu/cvc/papers/1998/conference/hyper1.ps,"Color Plate(<a href=""http://cvcweb.ices.utexas.edu/cvc/papers/1998/conference/hyper1-cp.pdf"">pdf</a>) (<a href=""http://cvcweb.ices.utexas.edu/cvc/papers/1998/conference/hyper1-cp.ps"">ps</a>)",12/4/2006 14:48,900,NULL,"(with V. Pascucci, G. Ribbiolo, D. Schikore)"
95,4,5,4,4,NULL,"C. Bajaj, V. Pascucci, D. Schikore",Visualization of Scalar Topology for Structural Enhancement,"Proceeding of the IEEE Visualization, pages 51-58, October 1998, Research Triangle Park, NC.",Conference Presentations & Publications,0,1998,http://ieeexplore.ieee.org/iel4/6019/16079/00745284.pdf?isnumber=16079&prod=CNF&arnumber=745284&arSt=51&ared=58&arAuthor=Bajaj%2C+C.L.%3B+Pascucci%2C+V.%3B+Schikore%2C+D.R.,http://cvcweb.ices.utexas.edu/cvc/papers/1998/conference/00745284.pdf,http://cvcweb.ices.utexas.edu/cvc/papers/1998/conference/top-viz98f.ps,,12/4/2006 14:48,900,NULL,"(with V. Pascucci, D. Schikore)"
96,6,6,6,6,NULL,"C. Bajaj, C. Baldazzi, S. Cutchin, A. Paoluzzi, V. Pascucci, M. Vicentino",Web-based approach for very complex animations through geometric programming,,Technical Reports,0,1998,http://cvcweb.ices.utexas.edu/cvc/papers/1998/techreports/plasm-anim.pdf,http://cvcweb.ices.utexas.edu/cvc/papers/1998/techreports/plasm-anim.pdf,http://cvcweb.ices.utexas.edu/cvc/papers/1998/techreports/plasm-anim.ps,,12/4/2006 14:11,800,NULL,"(with C. Baldazzi, S. Cutchin, A. Paoluzzi, V. Pascucci, M. Vicentino)"
97,6,6,6,6,NULL,"C. Bajaj, V. Pascucci, G. Zhuang",Compression and Coding of Large CAD Models,,Technical Reports,0,1998,http://cvcweb.ices.utexas.edu/cvc/papers/1998/techreports/cadzip.pdf,http://cvcweb.ices.utexas.edu/cvc/papers/1998/techreports/cadzip.pdf,http://cvcweb.ices.utexas.edu/cvc/papers/1998/techreports/cadzip.ps,,12/4/2006 14:49,800,NULL,"(with V. Pascucci, G. Zhuang)"
98,6,6,6,6,NULL,"C. Bajaj, S. Cutchin, V. Pascucci, G. Zhuang",Error Resilient Streaming of Compressed VRML,,Technical Reports,0,1998,http://cvcweb.ices.utexas.edu/cvc/papers/1998/techreports/i3dg.pdf,http://cvcweb.ices.utexas.edu/cvc/papers/1998/techreports/i3dg.pdf,http://cvcweb.ices.utexas.edu/cvc/papers/1998/techreports/i3dg.ps,,12/4/2006 14:45,800,NULL,"(with S. Cutchin, V. Pascucci, G. Zhuang)"
99,4,4,4,4,NULL,"C. Bajaj, S. Cutchin, V. Pascucci, A. Paoluzzi, C. Morgia, G. Scorzelli",Web Based Collaborative CAAD,,Technical Reports,0,1998,http://cvcweb.ices.utexas.edu/cvc/papers/1998/techreports/collabcaad.pdf,http://cvcweb.ices.utexas.edu/cvc/papers/1998/techreports/collabcaad.pdf,http://cvcweb.ices.utexas.edu/cvc/papers/1998/techreports/collabcaad.ps,,12/4/2006 14:45,800,NULL,"(with S. Cutchin, V. Pascucci, A. Paoluzzi, C. Morgia, G. Scorzelli)"
100,3,6,1,3,NULL,"C. Bajaj, G. Xu",Spline Approximations of Real Algebraic Surfaces,"Journal of Symbolic Computation, Special Isssue on Parametric Algebraic Curves and Applications, 23, 2-3, (1997), 315 - 333.",Journal Publications,0,1997,https://www.sciencedirect.com/science/article/pii/S0747717196900917,https://www.sciencedirect.com/science/article/pii/S0747717196900917,https://www.sciencedirect.com/science/article/pii/S0747717196900917,,10/14/2022 11:54,1000,,(with G. Xu)
1040,5,NULL,NULL,NULL,12,"JC. Cohrs, C. Bajaj, B. Berkels",A Distribution-Dependent Mumford-Shah Model for Unsupervised Hyperspectral Image Segmentation,"IEEE Transactions on Geoscience and Remote Sensing, 
Print ISSN: 0196-2892, 
Online ISSN: 1558-0644, 
Digital Object Identifier: 10.1109/TGRS.2022.3227061",Journal Publications,3,2022,https://arxiv.org/abs/2203.15058,NULL,NULL,NULL,12/7/2022 10:14,1000,NULL,NULL
104,3,6,1,3,NULL,"C. Bajaj, G. Xu",Piecewise Rational Approximation of Real Algebraic Curves,"Journal of Computational Mathematics, vol. 15, no. 1, (1997), 55-71.",Journal Publications,0,1997,http://cvcweb.ices.utexas.edu/cvc/papers/1997/journal/planecv.pdf,http://cvcweb.ices.utexas.edu/cvc/papers/1997/journal/planecv.pdf,http://cvcweb.ices.utexas.edu/cvc/papers/1997/journal/planecv.ps,,2/8/2007 11:12,1000,NULL,(with G. Xu)
103,3,4,3,3,NULL,"C. Bajaj, G. Xu",Modeling and Visualization of C1 and C2 Scattered Function Data on Curved Surfaces,"Proc. of 2nd Pacific Conference on Computer Graphics and Applications, PAC94, Beijing China, 19-29. Full version for Publication in Computer Aided Geometric Design, (1997).",Journal Publications,0,1997,http://cvcweb.ices.utexas.edu/cvc/papers/1997/journal/sfsonsfs2.pdf,http://cvcweb.ices.utexas.edu/cvc/papers/1997/journal/sfsonsfs2.pdf,http://cvcweb.ices.utexas.edu/cvc/papers/1997/journal/sfsonsfs2.ps,,12/4/2006 14:14,1000,NULL,(with G. Xu)
105,3,7,1,3,NULL,"C. Bajaj, F. Bernardini, G. Xu",Reconstructing Surfaces and Functions on Surfaces from Unorganized Three-Dimensional Data,"Algorithmica, 19, 1-2, (1997), 243-261.",Journal Publications,0,1997,http://www.springerlink.com/media/2pw78aqtlm1rrh34gt7r/contributions/e/y/w/c/eywc9edmv20d6c9d.pdf,http://cvcweb.ices.utexas.edu/cvc/papers/1997/journal/reconstr.pdf,http://cvcweb.ices.utexas.edu/cvc/papers/1997/journal/surfalg.ps,,2/8/2007 11:12,1000,NULL,"(with F. Bernardini, G. Xu)"
106,3,10,1,3,11,"C. Bajaj, S. Evans",Splines and Geometric Modeling,"CRC Handbook of Discrete and Computational Geometry, edited by J. Goodman and J. O'Rourke, CRC Series, Discrete and Combinatorial Mathematics, (1997), 833-849.",Book Chapters,0,1997,http://cvcweb.ices.utexas.edu/cvc/papers/1997/conference/crc-chap.pdf,http://cvcweb.ices.utexas.edu/cvc/papers/1997/conference/crc-chap.pdf,http://cvcweb.ices.utexas.edu/cvc/papers/1999/conference/crc-chap.ps,,12/14/2015 17:49,950,NULL,(with S. Evans)
107,3,6,10,1,11,C. Bajaj,Implicit Surface Patches,"Introduction to Implicit Surfaces, edited by J. Bloomenthal, Morgan Kaufman Publishers, (1997), 98-125.",Book Chapters,0,1997,,NULL,,,12/14/2015 17:49,950,NULL,NULL
108,3,4,3,3,11,C. Bajaj,Modeling Physical Fields for Interrogative Data Visualization,"7th IMA Conference on the Mathematics of Surfaces, The Mathematics of Surfaces VII, edited by T.N.T. Goodman and R. Martin, Oxford University Press, (1997).",Book Chapters,0,1997,,http://cvcweb.ices.utexas.edu/cvc/papers/1997/conference/bajaj97modeling.pdf,,,12/14/2015 17:49,950,NULL,NULL
109,4,7,4,4,NULL,"C. Bajaj, S. Cutchin",Web Based Collaboration-Aware Synthetic Environments,"Proceedings of the 1997 GVU/NIST TEAMCAD workshop, Atlanta, GA, 1997, 143 - 150.",Conference Presentations & Publications,0,1997,,NULL,,,12/4/2006 14:43,900,NULL,(with S. Cutchin)
110,4,5,6,4,NULL,"C. Bajaj, V. Pascucci, D.Schikore",The Contour Spectrum,"Proceedings of the 1997 IEEE Visualization Conference,167-173, October 1997 Phoeniz, Arizona.",Conference Presentations & Publications,0,1997,http://ieeexplore.ieee.org/iel4/5302/14360/00663875.pdf?isnumber=14360&prod=CNF&arnumber=663875&arSt=167&ared=173%2C+539&arAuthor=Bajaj%2C+C.L.%3B+Pascucci%2C+V.%3B+Schikore%2C+D.R.,http://cvcweb.ices.utexas.edu/cvc/papers/1997/conference/00663875.pdf,,,12/4/2006 14:52,900,NULL,"(with V. Pascucci, D.Schikore)"
111,6,6,6,6,NULL,"F. Bernardini, C. Bajaj",Sampling and Reconstructing Manifolds using Alpha-Shapes,"Proc. of the Ninth Canadian Conference on Computational Geometry, 193-198, August 1997.",Conference Presentations & Publications,0,1997,http://cvcweb.ices.utexas.edu/cvc/papers/1997/conference/manirec.pdf,http://cvcweb.ices.utexas.edu/cvc/papers/1997/conference/manirec.pdf,http://cvcweb.ices.utexas.edu/cvc/papers/1997/conference/manirec.ps,,12/4/2006 14:54,900,NULL,(with F. Bernardini)
112,3,6,3,3,NULL,"F. Bernardini, C. Bajaj, J. Chen, D. Schikore",A Triangulation-based Object Reconstruction Method,"In 6th Annual Video Review of Computational Geometry, 13th ACM Symposium on Computational Geometry. ACM, 1997.",Conference Presentations & Publications,0,1997,http://portal.acm.org/ft_gateway.cfm?id=263098&type=pdf&coll=GUIDE&dl=GUIDE&CFID=76542727&CFTOKEN=28220507,http://cvcweb.ices.utexas.edu/cvc/papers/1997/conference/p481-bernardini.pdf,http://cvcweb.ices.utexas.edu/cvc/papers/1997/conference/four-page.ps,,12/4/2006 14:54,900,NULL,"(with F. Bernardini, J. Chen, D. Schikore)"
113,4,6,4,4,NULL,"M. van Kreveld, R. van Oostrum, C. Bajaj, V. Pascucci, D. Schikore",Contour Trees and Small Seed Sets for Isosurface Traversal,"In Proceedings Thirteenth ACM Symposium on Computational Geometry (Theoretical Track), (Nice, France, June 4-6, (1997), ACM Press, pp. 212-219.",Conference Presentations & Publications,0,1997,http://portal.acm.org/ft_gateway.cfm?id=269238&type=pdf&coll=GUIDE&dl=GUIDE&CFID=76542571&CFTOKEN=54825229,http://cvcweb.ices.utexas.edu/cvc/papers/1997/conference/p212-van_kreveld.pdf,http://cvcweb.ices.utexas.edu/cvc/papers/1997/conference/SoCG97.ps,,12/4/2006 14:58,900,NULL,"(with M. van Kreveld, R. van Oostrum, V. Pascucci, D. Schikore)"
114,2,3,1,3,NULL,"C. Bajaj, H. Lee, R. Merkert, V. Pascucci",NURBS based B-rep Models from Macromolecules and their Properties,"In Proceedings of Fourth Symposium on Solid Modeling and Applications, Atlanta,Georgia, 1997, C. Hoffmann and W. Bronsvort Eds., ACM Press. pp. 217-228.",Conference Presentations & Publications,0,1997,http://portal.acm.org/ft_gateway.cfm?id=267787&type=pdf&coll=portal&dl=ACM&CFID=76542826&CFTOKEN=59141155,http://cvcweb.ices.utexas.edu/cvc/papers/1997/conference/p217-bajaj.pdf,http://cvcweb.ices.utexas.edu/cvc/papers/1997/conference/SM97.ps,,2/8/2007 11:17,900,NULL,"(with H. Lee, R. Merkert, V. Pascucci)"
116,8,8,8,8,NULL,"C. Bajaj, F. Bernardini, S. Cutchin, K. Lin, E. Sacks, D. Schikore",Comprehensive Analysis of Joints from Patient Clinical Data,"Technical Report 97-019, Purdue University, Computer Sciences, (1997).",Technical Reports,0,1997,http://cvcweb.ices.utexas.edu/cvc/papers/1997/techreports/cagd97.pdf,http://cvcweb.ices.utexas.edu/cvc/papers/1997/techreports/cagd97.pdf,http://cvcweb.ices.utexas.edu/cvc/papers/1997/techreports/cagd97.ps,,12/4/2006 14:12,800,NULL,"(with F. Bernardini, S. Cutchin, K. Lin, E. Sacks, D. Schikore)"
118,1,2,6,1,NULL,"C. Bajaj, E. Coyle, K. Lin",Arbitrary Topology Shape Reconstruction from Planar Cross Sections,"Graphical Models and Image Processing, 58:6, (1996), 524-543.",Journal Publications,0,1996,http://cvcweb.ices.utexas.edu/cvc/papers/1996/journal/tiling-1996.pdf,http://cvcweb.ices.utexas.edu/cvc/papers/1996/journal/sdarticle.pdf,,,3/1/2013 9:01,1000,NULL,"(with E. Coyle, K. Lin)"
120,6,10,10,10,11,C. Bajaj,The Combinatorics of Real Algebraic Splines over a Simplicial Complex,"Real Number Algorithms, edited by J. Renegar, M. Shub, and S. Smale, AMS Lecture Notes in Mathematics, (1996).",Book Chapters,0,1996,,NULL,http://cvcweb.ices.utexas.edu/cvc/papers/1996/conference/algsplinesimp.ps,,9/19/2016 16:00,950,NULL,NULL
121,3,1,3,3,11,C. Bajaj,Free-Form Modeling with Implicit Surface Patches,"Implicit Surfaces, edited by J. Bloomenthal abd B. Wyvill, Morgan Kaufman Publishers, (1996).",Book Chapters,0,1996,http://cvcweb.ices.utexas.edu/cvc/papers/1996/conference/all.pdf,http://cvcweb.ices.utexas.edu/cvc/papers/1996/conference/all.pdf,http://cvcweb.ices.utexas.edu/cvc/papers/1996/conference/all.ps.gz,,12/14/2015 17:49,950,NULL,NULL
122,4,6,7,6,NULL,"C. Bajaj, D. Schikore",Error-Bounded Reduction of Triangle Meshes with Multivariate Data,"Proceedings: Visual Data Exploration and Analysis III, SPIE vol 2656, (1996), 34-45.",Conference Presentations & Publications,0,1996,http://spiedl.aip.org/getpdf/servlet/GetPDFServlet?filetype=pdf&id=PSISDG002656000001000034000001&idtype=cvips&prog=normal,http://cvcweb.ices.utexas.edu/cvc/papers/1996/conference/surf4.pdf,http://cvcweb.ices.utexas.edu/cvc/papers/1996/conference/surf4.ps,,12/4/2006 14:11,900,NULL,(with D. Schikore)
123,6,6,6,6,NULL,"C. Bajaj, V. Pascucci",Splitting a Complex of Convex Polytopes in Any Dimension,"Proceedings: 12th Annual ACM Symposium on Computational Geometry, ACM Press, (1996), Philadelphia, PA, 88-97.",Conference Presentations & Publications,0,1996,http://portal.acm.org/ft_gateway.cfm?id=237246&type=pdf&coll=portal&dl=ACM&CFID=1262340&CFTOKEN=90535216,http://cvcweb.ices.utexas.edu/cvc/papers/1996/conference/p88-bajaj.pdf,,,12/4/2006 14:47,900,NULL,(with V. Pascucci)
124,4,5,6,5,NULL,"C. Bajaj, V. Pascucci, D. Schikore",Fast Isocontouring for Improved Interactivity,"Proceedings: ACM Siggraph/IEEE Symposium on Volume Visualization, ACM Press, (1996), San Francisco, CA. Pages: 39-46 (text) 99 (color plate).",Conference Presentations & Publications,0,1996,http://ieeexplore.ieee.org/iel3/4135/12156/00558041.pdf?isnumber=12156&prod=CNF&arnumber=558041&arSt=39&ared=46%2C+99&arAuthor=Bajaj%2C+C.L.%3B+Pascucci%2C+V.%3B+Schikore%2C+D.R.,http://cvcweb.ices.utexas.edu/cvc/papers/1996/conference/00558041.pdf,http://cvcweb.ices.utexas.edu/cvc/papers/1996/conference/contour.ps,,12/4/2006 14:48,900,NULL,"(with V. Pascucci, D. Schikore)"
125,3,6,3,3,NULL,"C. Bajaj, F. Bernardini, J. Chen, D. Schikore",Automatic Reconstruction of 3D CAD Models,"Proceedings: International Conference on Theory and Practice of Geometric Modeling, Blaubeuren, (1996), Springer-Verlag.",Conference Presentations & Publications,0,1996,http://cvcweb.ices.utexas.edu/cvc/papers/1996/conference/sharp.pdf,http://cvcweb.ices.utexas.edu/cvc/papers/1996/conference/sharp.pdf,http://cvcweb.ices.utexas.edu/cvc/papers/1996/conference/sharp.ps,,12/4/2006 14:11,900,NULL,"(with F. Bernardini, J. Chen, D. Schikore)"
126,8,8,8,8,NULL,"C. Bajaj, F. Bernardini, K. Lin, E. Sacks, D. Schikore",Physical Simulation of the Visible Human Joints,"The Visible Human Project Conference, 1996.",Conference Presentations & Publications,0,1996,,NULL,http://www.nlm.nih.gov/research/visible/vhp_conf/bajajphy/vhp_phys.ps,,9/19/2016 16:00,900,NULL,"(with F. Bernardini, K. Lin, E. Sacks, D. Schikore)"
127,4,5,4,4,NULL,"C. Bajaj, F. Bernardini, V. Pascucci, D. Schikore",Interrogative Visualization of the Visible Human Datasets,"The Visible Human Project Conference, 1996.",Conference Presentations & Publications,0,1996,,NULL,http://www.nlm.nih.gov/research/visible/vhp_conf/bajajvis/vhp_vis.ps,,9/19/2016 16:00,900,NULL,"(with F. Bernardini, V. Pascucci, D. Schikore)"
128,1,6,1,1,NULL,"C. Bajaj, E. Coyle, K. Lin",Boundary and 3D Triangular Meshes from Planar Cross Sections,"Proceedings: The Fifth International Meshing Roundtable, Sandia National Lab., Sandia Report SAND96-2301, UC-405, (1996), Pittsburgh, PA, 169-178.",Conference Presentations & Publications,0,1996,,NULL,http://www.imr.sandia.gov/papers/imr5/Bajaj6531.ps.gz,,9/19/2016 16:00,900,NULL,"(with E. Coyle, K. Lin)"
129,4,7,4,4,NULL,"C. Bajaj, N. Osumi, M. Shinya, T. Mori, T. Sunaga, D. Cutchin, R. Merkert",NLS: Collaborative Virtual Environment to Promote Shared Awareness,"Proceedings: Workshop on New Paradigms in Information Visualization and Manipulation, NPIV'96, In conjunction with Fifth ACM International Conference on Information and Knowledge Management (CIKM'96), (1996), pp. 41-45.",Conference Presentations & Publications,0,1996,,NULL,,,12/4/2006 14:42,900,NULL,"(with N. Osumi, M. Shinya, T. Mori, T. Sunaga, D. Cutchin, R. Merkert)"
130,4,6,6,6,NULL,C. Bajaj,Computational Geometry for Interrogative Visualization,"Proceedings of the 8th Canadian Conference on Computational Geometry (CCCG'96). Ottawa, Ontario, Canada. Pages 99-100.",Conference Presentations & Publications,0,1996,http://www.cccg.ca/proceedings/1996/cccg1996_0017.pdf,http://cvcweb.ices.utexas.edu/cvc/papers/1996/conference/cccg1996_0017.pdf,,,9/29/2006 15:02,900,NULL,NULL
