PaperID,CatID,CatID2,CatID3,CatID4,CatID_gen,Authors,Title,Location,PublicationType,PublishedDateMonth,PublishedDateYear,PDFLink,LocalPDFLink,PSLink,Abstract,RegisterDate,sortOrder,ProjectLink,OtherAuthors
178,6,6,6,6,NULL,"C. Bajaj, J. Canny, T. Garrity, J. Warren",Factoring Rational Polynomials over the Complexes,"Proceedings of the ACM-SIGSAM 1989 international symposium on Symbolic and algebraic computation 
1989, Portland, Oregon, United States, July 17 - 19, 1989, 81-90.",Journal Publications,0,1989,http://portal.acm.org/ft_gateway.cfm?id=74551&type=pdf&coll=portal&dl=ACM&CFID=76559993&CFTOKEN=82249037,http://cvcweb.ices.utexas.edu/cvc/papers/1989/journal/p81-bajaj.pdf,,,12/4/2006 14:33,1000,NULL,"(with J. Canny, T. Garrity, J. Warren)"
180,3,6,10,1,11,C. Bajaj,The Emergence of Algebraic Curves and Surfaces in Geometric Design,"Directions in Geometric Computing, edited by R. Martin, Information Geometers Press, United Kingdom (1993), Chapter 1, 1-29.",Book Chapters,0,1993,,http://cvcweb.ices.utexas.edu/cvc/papers/1993/conference/TR92-056.pdf,,,12/14/2015 17:49,950,NULL,NULL
181,3,4,7,10,NULL,C. Bajaj,Multi-dimensional Hermite Interpolation and Approximation for Modeling and Visualization,"Proceedings: The IFIP TC5/WG5.2/WG5.10 CSI International Conference on Computer Graphics, ICCG93, (1993), IFIP Transactions B-9, North Holland, 335-348.
Graphics, Design and Visualization, ed. by S. Mudur, S. Pattanaik.",Conference Presentations & Publications,0,1993,http://cvcweb.ices.utexas.edu/cvc/papers/1993/conference/multidim.pdf,http://cvcweb.ices.utexas.edu/cvc/papers/1993/conference/multidim.pdf,http://cvcweb.ices.utexas.edu/cvc/papers/1993/conference/multidim.ps,,10/1/2006 22:41,900,NULL,NULL
182,3,4,8,4,NULL,"C. Bajaj, D. Schikore",Distributed Design of Hip Prosthesis using BHAUTIK,"Proceedings: The 1993 ACM/SIGAPP Symposium on Applied Computing, (1993), Indianapolis, Indiana, ACM Press, 36-39.",Conference Presentations & Publications,0,1993,http://portal.acm.org/ft_gateway.cfm?id=162792&type=pdf&coll=ACM&dl=ACM&CFID=76561300&CFTOKEN=84755449,http://cvcweb.ices.utexas.edu/cvc/papers/1993/conference/p36-bajaj.pdf,,,12/4/2006 14:11,900,NULL,(with D. Schikore)
183,3,5,5,5,NULL,"C. Bajaj, M. Fields",The VAIDAK Medical Image Model Reconstruction Toolkit,"Proceedings: The 1993 ACM/SIGAPP Symposium on Applied Computing, (1993), Indianapolis, Indiana, ACM Press, 28-35.",Conference Presentations & Publications,0,1993,http://portal.acm.org/ft_gateway.cfm?id=162788&type=pdf&coll=ACM&dl=ACM&CFID=76561300&CFTOKEN=84755449,http://cvcweb.ices.utexas.edu/cvc/papers/1993/conference/p28-bajaj.pdf,http://cvcweb.ices.utexas.edu/cvc/papers/1993/conference/vaidak-man.ps,,12/4/2006 14:42,900,NULL,(with M. Fields)
184,3,7,3,3,NULL,"C. Bajaj, I. Ihm",Low Degree Approximations of Surfaces for Revolved Objects,"Proceedings: Graphics Interface '93, (1993) Toronto, Canada, Canadian Information Processing Society, 33-41.",Conference Presentations & Publications,0,1993,,http://cvcweb.ices.utexas.edu/cvc/papers/1993/conference/TR92-084.pdf,,,12/4/2006 14:30,900,NULL,(with I. Ihm)
185,4,7,4,4,NULL,"C. Bajaj, S. Cutchin",The GATI Client-Server Animation Toolkit,"Proceedings: Computer Graphics International, CGI93, Communicating with Virtual Worlds, edited by N. Thalmann and D. Thalmann, Springer Verlag, (1993), 413-423.",Conference Presentations & Publications,0,1993,,http://cvcweb.ices.utexas.edu/cvc/papers/1993/conference/TR92-096.pdf,,,12/4/2006 14:43,900,NULL,(with S. Cutchin)
186,3,4,4,4,NULL,C. Bajaj,Distributed and Collaborative Modeling and Visualization,"Proceedings: The IEEE Visualization '93 Workshop on Intelligent Visualization Systems, San Jose, Ca, Chapter 12, (1993).",Conference Presentations & Publications,0,1993,,NULL,,,5/25/2006 18:57,900,NULL,NULL
187,3,4,8,4,NULL,"V. Anupam, C. Bajaj, S. Cutchin, S. Evans, I. Ihm, J. Chen, A. Royappa, D. Schikore, G. Xu",Scientific Problem Solving in a Distributed and Collaborative Geometric Environment,"3rd International Conference on Expert Systems for Numerical Computing, May 17-19, 1993, West Lafayette, IN.",Conference Presentations & Publications,0,1993,,NULL,,,12/4/2006 15:04,900,NULL,"(with V. Anupam, S. Cutchin, S. Evans, I. Ihm, J. Chen, A. Royappa, D. Schikore, G. Xu)"
188,4,4,4,4,NULL,"C. Bajaj, J. Chen, S. Evans",Distributed Modeling and Rendering of Splines Using Ganith,"Technical Report 93-006 (29 pages), Purdue University, Computer Sciences (1/93).",Technical Reports,0,1993,,http://cvcweb.ices.utexas.edu/cvc/papers/1993/techreports/TR93-006.pdf,,,12/4/2006 14:42,800,NULL,"(with J. Chen, S. Evans)"
189,4,4,4,4,NULL,"V. Anupam, C. Bajaj",Collaborative multimedia game environments,"Technical Report 93-086 (13 pages), Purdue University, Computer Sciences (12/93).",Technical Reports,0,1993,,http://cvcweb.ices.utexas.edu/cvc/papers/1993/techreports/TR93-086.pdf,,,12/4/2006 15:01,800,NULL,(with V. Anupam)
190,3,3,3,3,NULL,"C. Bajaj, G. Xu",Trivariate Interpolation for Scientific Visualization,"Technical Report 93-032, Purdue University, Computer Sciences (6/93).",Technical Reports,0,1993,,NULL,,,12/4/2006 14:52,800,NULL,(with G. Xu)
191,3,6,3,3,NULL,"C. Bajaj, I. Ihm",Hermite Interpolation of Rational Space Curves using Real Algebraic Surfaces,"Proceedings: 5th Annual ACM Symposium on Computational Geometry, Saarbrucken, West Germany, (1989), 94-103.",Journal Publications,0,1989,http://portal.acm.org/ft_gateway.cfm?id=73844&type=pdf&coll=portal&dl=ACM&CFID=76561841&CFTOKEN=9452841,http://cvcweb.ices.utexas.edu/cvc/papers/1989/journal/p94-bajaj.pdf,,,12/4/2006 14:30,1000,NULL,(with I. Ihm)
192,1,6,6,6,NULL,"C. Bajaj, T. Dey",Robust Decompositions of Polyhedra,"Proceedings: Ninth Conference on Foundations of Software Technology and Theoretical Computer Science, Lecture Notes in Computer Science, No. 405, Springer-Verlag, (1989), 267-279.",Journal Publications,0,1989,,http://cvcweb.ices.utexas.edu/cvc/papers/1992/journal/TR91-056.pdf,,,12/4/2006 14:46,1000,,(with T. Dey)
193,1,6,6,6,NULL,"T. Dey, C. Bajaj, K. Sugihara",On Good Triangulations in Three Dimensions,"Proceedings: The ACM Symposium on Solid Modeling Foundations and CAD/CAM Applications, (1991), 431-441.",Journal Publications,0,1991,http://portal.acm.org/ft_gateway.cfm?id=112578&type=pdf&coll=ACM&dl=ACM&CFID=76562125&CFTOKEN=50986033,http://cvcweb.ices.utexas.edu/cvc/papers/1991/conference/p431-dey.pdf,,,12/4/2006 15:01,900,NULL,"(with T. Dey, K. Sugihara)"
194,3,7,1,3,NULL,"C. Bajaj, I. Ihm",Smoothing Polyhedra using Implicit Algebraic Splines,"Computer Graphics, 26, 2, (1992), 79-88. Proceedings: 1992 ACM Transactions on Graphics, SIGGRAPH 92, Chicago, Illinois.",Journal Publications,0,1992,http://portal.acm.org/ft_gateway.cfm?id=134014&type=pdf&coll=portal&dl=ACM&CFID=76562359&CFTOKEN=73152559,http://cvcweb.ices.utexas.edu/cvc/papers/1992/journal/p79-bajaj.pdf,,,2/8/2007 11:15,1000,NULL,(with I. Ihm)
195,1,6,6,6,NULL,"T. Dey, K. Sugihara, C. Bajaj",Delaunay Triangulations in Three Dimensions with Finite Precision Arithmetic,"Computer Aided Geometric Design, 9:6(1992), 457-470.",Journal Publications,0,1992,http://www.sciencedirect.com/science?_ob=MImg&_imagekey=B6TYN-45D9TCJ-6-1&_cdi=5623&_user=108429&_orig=browse&_coverDate=12%2F31%2F1992&_sk=999909993&view=c&wchp=dGLbVtb-zSkWW&md5=be0c5df6961a742ee3994af7f4b68c6b&ie=/sdarticle.pdf,NULL,,,12/4/2006 15:01,1000,NULL,"(with T. Dey, K. Sugihara)"
196,3,6,3,3,11,C. Bajaj,Surface Fitting with Implicit Algebraic Surface Patches,"Topics in Surface Modeling, edited by H. Hagen, SIAM Publications, (1992), Chapter 2, 23-52.",Book Chapters,0,1992,,http://cvcweb.ices.utexas.edu/cvc/papers/1992/conference/TR90-1001.pdf,,,12/14/2015 17:49,950,NULL,NULL
197,3,6,7,1,NULL,"C. Bajaj, A. Royappa",Robust Display of Arbitrary Rational Parametric Surfaces,"Curves and Surfaces in Computer Vision and Graphics III <br>Proceedings: Symposium on Electronic Imaging Science and Technology, Boston, Massachusetts, vol. 1830, (1992), 70-80.",Conference Presentations & Publications,0,1992,http://spiedl.aip.org/getpdf/servlet/GetPDFServlet?filetype=pdf&id=PSISDG001830000001000070000001&idtype=cvips&prog=normal,http://cvcweb.ices.utexas.edu/cvc/papers/1992/conference/TR92-054.pdf,,"A well-known strength of the parametric representation of a curve or surface is the ease 
by which a piecewise-linear approximation is generated. This is often true in geometric 
design, where only smooth segments or patches are considered over a well-chosen polynomial basis. 
Visualizing an arbitrary and possibly discontinuous parametric surface is useful but 
non-trivial for algebraic surfaces defined by rational parameter functions. Such surfaces have 
pole curves in their domain, where the denominators of the parameter functions vanish, 
domain base points that correspond to entire curves on the surface, and other features that 
cause display algorithms to fail. These are ubiquitous problems occurring even among the 
natural quadrics. Sophisticated but unsuspecting display techniques (e.g. those implemented in 
Maple V, Mathmatica) produce completely unintelligible results. We provide a general 
solution and discuss our implementation. First, projective domain transformations are applied 
that map the entire surface from a finite domain region. Then, domain pole curves are identified 
and numerically approximated. Using Delaunay triangulation, a special decomposition of the 
domain is constructed that avoids discontinuities. This is then mapped onto the 
surface and clipped against a 3D box. The implementation can display very complicated 
surfaces, as we shall illustrate. Our techniques generalize in a straightforward way to rational 
varieties of any dimension.",2/8/2007 11:20,900,NULL,(with A. Royappa)
198,3,6,7,3,NULL,"C. Bajaj, A. Royappa",Parameterization in Finite Precision,"Proceedings: Graphics Interface '92, (1992), Vancouver, Canada, Canadian Information Processing Society, 29-36.",Conference Presentations & Publications,0,1992,,http://cvcweb.ices.utexas.edu/cvc/papers/2000/journal/algor98.pdf,http://cvcweb.ices.utexas.edu/cvc/papers/2000/journal/algor98.ps,,12/4/2006 14:02,900,NULL,(with A. Royappa)
199,1,3,6,3,NULL,C. Bajaj,Algebraic Surface Design and Finite Element Meshes,"Proceedings: The NASA Workshop on Software Systems for Surface Modeling and Grid Generation, NASA Langley Research Publication 3143, (1992), 121-131.",Conference Presentations & Publications,0,1992,,http://cvcweb.ices.utexas.edu/cvc/papers/1992/conference/TR92-011.pdf,,,10/2/2006 15:47,900,NULL,NULL
200,3,3,3,3,NULL,"C. Bajaj, G. Xu",A-splines: Local interpolation and approximation using continuous piecewise real algebraic curves,"Technical Report 92-095, Purdue University, Computer Sciences (12/92).",Technical Reports,0,1992,,http://cvcweb.ices.utexas.edu/cvc/papers/1999/journal/sdarticle02.pdf,http://cvcweb.ices.utexas.edu/cvc/papers/1999/journal/aspline.ps,,12/4/2006 14:14,800,NULL,(with G. Xu)
201,3,3,3,3,NULL,"C. Bajaj, K. Sugihara",Geometric Search and Replace in Solid Modeling Editing,"Technical Report 92-078 (11 pages), Purdue University, Computer Sciences (10/14/92).",Technical Reports,0,1992,,http://cvcweb.ices.utexas.edu/cvc/papers/1992/techreports/TR92-078.pdf,,,12/4/2006 14:42,800,NULL,(with K. Sugihara)
202,3,3,3,3,NULL,"V. Anupam, C. Bajaj",The Shilp Solid Modeling and Display Toolkit in v 1.1,"Technical Report 92-072 (43 pages), Purdue University, Computer Sciences (10/92).",Technical Reports,0,1992,http://cvcweb.ices.utexas.edu/cvc/papers/1992/techreports/shilp-man.pdf,http://cvcweb.ices.utexas.edu/cvc/papers/1992/techreports/shilp-man.pdf,http://cvcweb.ices.utexas.edu/cvc/papers/1992/techreports/shilp-man.ps,,12/4/2006 15:01,800,NULL,(with V. Anupam)
203,2,3,3,3,NULL,C. Bajaj,Electronic Skeletons: Modeling Skeletal Structures with Piecewise Algebraic Surfaces,"Curves and Surfaces in Computer Vision and Graphics 2: Proceedings of the Symposium on Electronic Imaging Science and Technology, volume 1610, pages 230-237, Boston, MA, 1991.",Conference Presentations & Publications,0,1991,http://spiedl.aip.org/getpdf/servlet/GetPDFServlet?filetype=pdf&id=PSISDG001610000001000230000001&idtype=cvips&prog=normal,http://cvcweb.ices.utexas.edu/cvc/papers/1991/conference/TR91-076.pdf,,"We present two algorithms to construct C1-smooth models of skeletal structures from CT/NMR voxel 
data. The boundary of the reconstructed models consists of a C1- continuous mesh of triangular 
algebraic surface patches. One algorithm first constructs C1-continuous piecewise conic contours 
on each of the CT/NMR data slices and then uses piecewise triangular algebraic surface patches to 
C1 interpolate the contours on adjacent slices. The other algorithm works directly in voxel space 
and replaces an initial C0 triangular facet approximation of the model with a highly 
compressed C1- continuous mesh of triangular algebraic surface patches. Both schemes are 
adaptive, yielding a higher density of patches in regions of higher curvature.",10/2/2006 15:49,900,NULL,NULL
204,3,3,3,3,NULL,"B. Bailey, C. Bajaj, M. Fields",The Vaidak Medical Imaging and Model Reconstruction Toolkit,"Technical Report 91-066 (21 pages), Purdue University, Computer Sciences (8/30/91).",Technical Reports,0,1991,http://cvcweb.ices.utexas.edu/cvc/papers/1991/techreports/vaidak-man.pdf,http://cvcweb.ices.utexas.edu/cvc/papers/1991/techreports/vaidak-man.pdf,http://cvcweb.ices.utexas.edu/cvc/papers/1991/techreports/vaidak-man.ps,,12/4/2006 14:02,800,NULL,"(with B. Bailey, M. Fields)"
205,4,4,4,4,NULL,"V. Anupam, C. Bajaj, M. Fields, A. Royappa",Portable 3D Graphics in a Heterogeneous Distributed Environment,"Technical Report 91-074 (7 pages), Purdue University, Computer Sciences (10/17/91).",Technical Reports,0,1991,,http://cvcweb.ices.utexas.edu/cvc/papers/1991/techreports/TR91-074.pdf,,,12/4/2006 15:04,800,NULL,"(with V. Anupam, M. Fields, A. Royappa)"
206,3,3,3,3,NULL,"V. Anupam, C. Bajaj, A. Burnett, M. Fields, A. Royappa, D. Schikore",XS: A Hardware Independent Graphics and Windowing Library,"Technical Report 91-062 (16 pages), Purdue University, Computer Sciences (8/28/91) CAPO-91-28 1991.",Technical Reports,0,1991,,http://cvcweb.ices.utexas.edu/cvc/papers/1991/techreports/TR91-062.pdf,,,12/4/2006 15:04,800,NULL,"(with V. Anupam, A. Burnett, M. Fields, A. Royappa, D. Schikore)"
207,3,6,6,6,NULL,"C. Bajaj, M. Kim",Compliant Motion Planning with Geometric Models,"Proceedings: 3rd ACM Symposium on Computational Geometry, Waterloo, Canada, (1987), 171-180.",Conference Presentations & Publications,0,1987,http://portal.acm.org/ft_gateway.cfm?id=41976&type=pdf&coll=ACM&dl=ACM&CFID=71965418&CFTOKEN=25451112,http://cvcweb.ices.utexas.edu/cvc/papers/1987/conference/p171-bajaj.pdf,,"We present algebraic algorithms to generate the boundary of configuration space obstacles arising 
from the translatory motion of objects amongst obstacles. In particular we consider obtaining 
compliant motion paths where a curved convex object with fixed orientation moves in continuous 
contact with the boundary of curved convex obstacles in three Dimensions. Both the 
boundaries of the objects and obstacles are given by patches of algebraic surfaces. We also give a 
method to obtain approximate geodesic paths on convex C-space obstacles with algebraic boundary 
surfaces.",12/4/2006 14:42,900,NULL,(with M. Kim)
208,3,6,1,3,NULL,"C. Bajaj, M. Kim",Convex Hulls of Objects bounded by Algebraic Curves,"Algorithmica, 6, 1, (1990), 533-553.",Journal Publications,0,1990,"http://www.springerlink.com/(5ki02haxqu1oi43cis4az4u3)/app/home/contribution.asp?referrer=parent&backto=issue,28,47;journal,162,167;linkingpublicationresults,1:100117,1",http://cvcweb.ices.utexas.edu/cvc/papers/1990/journal/TR87-697.pdf,,,2/8/2007 11:15,1000,NULL,(with M. Kim)
209,3,3,3,3,NULL,"J. Johnstone, C. Bajaj",Sorting Points along an Algebraic Curve,"Siam Journal on Computing, 19, 5, (1990), 925-967.",Journal Publications,0,1990,http://locus.siam.org/fulltext/SICOMP/volume-19/0219065.pdf,http://cvcweb.ices.utexas.edu/cvc/papers/1990/journal/TR88-824.pdf,,,12/4/2006 14:57,1000,NULL,(with J. Johnstone)
210,3,6,7,3,NULL,C. Bajaj,Rational Hypersurface Display,"Computer Graphics, 24, 2, (1990), 117-127. Proceedings: 1990 ACM Symposium on Interactive 3D Graphics, Snowbird, Utah.",Journal Publications,0,1990,http://portal.acm.org/ft_gateway.cfm?id=91428&type=pdf&coll=portal&dl=ACM&CFID=71964949&CFTOKEN=32193995,http://cvcweb.ices.utexas.edu/cvc/papers/1990/journal/p117-bajaj.pdf,,,9/29/2006 13:24,1000,NULL,NULL
211,6,6,6,6,NULL,"C. Bajaj, T. Dey",Robust Computations of Polygon Nesting,"Proceedings: International Workshop on Discrete Algorithms and Complexity, Fukuoka, Japan, (1989), 33-40.",Journal Publications,0,1990,,NULL,,,12/4/2006 14:46,1000,NULL,(with T. Dey)
212,3,6,10,1,11,C. Bajaj,Geometric Modeling with Algebraic Surfaces,"The Mathematics of Surfaces III, edited by D. Handscomb, Oxford University Press, (1990), Chapter I, 3-48. <br>Invited Paper: 3rd IMA, Conference on the Mathematics of Surfaces.",Book Chapters,0,1990,,http://cvcweb.ices.utexas.edu/cvc/papers/1990/conference/TR88-825.pdf,,,12/14/2015 17:49,950,NULL,NULL
213,3,6,7,3,NULL,"C. Bajaj, A. Royappa",The GANITH Algebraic Geometry Toolkit,"Proceedings: 1st Annual Conference on the Design and Implementation of Symbolic Computation Systems, Lecture Notes in Computer Science, No. 429, Springer-Verlag, (1990), 268-269.",Conference Presentations & Publications,0,1990,,http://cvcweb.ices.utexas.edu/cvc/papers/1990/conference/TR91-065.pdf,,,12/4/2006 14:02,900,NULL,(with A. Royappa)
214,6,6,6,6,NULL,C. Bajaj,Geometric Computations with Algebraic Varieties of Bounded Degree,"Proceedings: 6th Annual ACM Symposium on Computational Geometry, (1990) Berkeley, California, 148-156.",Conference Presentations & Publications,0,1990,http://portal.acm.org/ft_gateway.cfm?id=98557&type=pdf&coll=portal&dl=ACM&CFID=71965503&CFTOKEN=98919752,http://cvcweb.ices.utexas.edu/cvc/papers/1990/conference/p148-bajaj.pdf,http://cvcweb.ices.utexas.edu/cvc/papers/1990/conference/comp90.ps,,10/1/2006 19:24,900,NULL,NULL
215,6,6,6,6,NULL,"C. Bajaj, W. Bouma",Dynamic Voronoi Diagrams and Delaunay Triangulations,"Proceedings: The 2nd Annual Canadian Conference on Computational Geometry, (1990), Ottawa, Canada, 273-277.",Conference Presentations & Publications,0,1990,,NULL,,,12/4/2006 14:52,900,NULL,(with W. Bouma)
216,3,7,3,3,NULL,C. Bajaj,G1 Interpolation Using Piecewise Quadric and Cubic Surfaces,"Proceedings of SPIE - Volume 1251, Curves and Surfaces in Computer Vision and Graphics, Leonard A. Ferrari, Rui J. P. de Figueiredo, Editors, August 1990, pp. 82-93.",Conference Presentations & Publications,0,1990,http://spiedl.aip.org/getpdf/servlet/GetPDFServlet?filetype=pdf&id=PSISDG001251000001000082000001&idtype=cvips&prog=normal,http://cvcweb.ices.utexas.edu/cvc/papers/1990/conference/TR90-947.pdf,,"Algorithms are presented for constructing G' continuous meshes of degree two (quadric) and 
degreethree (cubic) implicitly defined, piecewise algebraic surfaces, which exactly fit any given 
collection ofpoints and algebraic space curves, of arbitrary degree. A combination of techniques 
are used fromcomputational algebraic geometry and numerical approximation theory which reduces the 
problem tosolving coupled systems of linear equations and low degree, polynomial equations.",10/2/2006 16:03,900,NULL,NULL
217,3,3,3,3,NULL,C. Bajaj,"Parametric, and Surface. Unifying Parametric and Implicit Surface Representations for Computer Graphics: Surface Display and Algebraic Fitting","Technical Report 995 (25 pages), Purdue University, Computer Sciences (7-18-90).",Technical Reports,0,1990,,http://cvcweb.ices.utexas.edu/cvc/papers/1990/techreports/TR90-995.pdf,,,10/2/2006 16:51,800,NULL,NULL
218,13,6,6,6,NULL,"C. Bajaj, M. Li",Geometric Optimization and D^P -Completeness,"Discrete and Computational Geometry, 4, 1, (1989), 3-13. <br>Abstract appears in Zentralblatt fur Mathematik.",Journal Publications,0,1989,"http://www.springerlink.com/(q3b3l455gm520euueajhud55)/app/home/contribution.asp?referrer=parent&backto=issue,2,43;journal,89,92;linkingpublicationresults,1:100356,1",NULL,,In this paper we show a number of natural geometric optimization problems in the plane to be complete for a class D^P. The class D^p contains both NP and Co-NP and is contained in Delta(sub 2) P =P^NP. Completeness in D^p is exhibited under many-one and positive reductions. Further an OptP(O(logn)) result is also obtained for some of these optimization problems.,11/22/2017 19:28,1000,NULL,(with M. Li)
219,6,6,6,6,NULL,"C. Bajaj, M. Kim",Generation of Configuration Space Obstacles: The Case of Moving Algebraic Curves,"Proceedings: 1987 IEEE International Conference on Robotics and Automation, Raleigh, North Carolina, volume 4, (March 1987), 979-984.",Journal Publications,0,1987,http://ieeexplore.ieee.org/iel5/8153/23644/01087939.pdf?tp=&arnumber=1087939&isnumber=23644,http://cvcweb.ices.utexas.edu/cvc/papers/1987/journal/01087939.pdf,,,12/4/2006 14:42,1000,NULL,(with M. Kim)
220,3,7,3,3,NULL,"S. Abhyankar, C. Bajaj",Automatic Parameterization of Rational Curves and Surfaces IV: Algebraic Space Curves,"ACM Transactions on Graphics, 8, 4, (1989), 325-334.",Journal Publications,0,1989,http://portal.acm.org/ft_gateway.cfm?id=77273&type=pdf&coll=portal&dl=ACM&CFID=71966325&CFTOKEN=40825847,http://cvcweb.ices.utexas.edu/cvc/papers/1989/journal/p325-abhyankar.pdf,,,12/4/2006 14:59,1000,NULL,(with S. Abhyankar)
221,3,6,6,6,NULL,"C. Bajaj, S. Abhyankar",Computations with Algebraic Curves,"Proceedings: International Symposium on Symbolic and Algebraic Computation, ISSAC88, Lecture Notes in Computer Science, No. 358, Springer-Verlag, (1989), 279-284.",Conference Presentations & Publications,0,1989,,http://cvcweb.ices.utexas.edu/cvc/papers/1989/conference/TR88-806.pdf,,,12/4/2006 14:43,900,NULL,(with S. Abhyankar)
222,3,6,6,6,NULL,C. Bajaj,"Local Parameterization, Implicitization and Inversion of Real Algebraic Curves","Proceedings: The International Conference on Applied Algebra, Algebraic Algorithms, And Error Correcting Codes, (AAECC-7), (1989), Toulouse, France.",Conference Presentations & Publications,0,1989,,http://cvcweb.ices.utexas.edu/cvc/papers/1989/conference/TR89-863.pdf,,,10/2/2006 16:10,900,NULL,NULL
223,3,3,3,3,NULL,C. Bajaj,Quadric and Cubic Hypersurface Parameterization,"Technical Report 881, Purdue University, Computer Sciences (4/27/89).",Technical Reports,0,1989,,http://cvcweb.ices.utexas.edu/cvc/papers/1989/techreports/TR89-881.pdf,,,10/2/2006 16:09,800,NULL,NULL
224,3,3,3,3,NULL,"R. Patterson, C. Bajaj",Curvature Adjusted Parameterization of Curves,"Technical Report 907 (16 pages), Purdue University, Computer Sciences (9/19/89).",Technical Reports,0,1989,,http://cvcweb.ices.utexas.edu/cvc/papers/1989/techreports/TR89-907.pdf,,,12/4/2006 14:59,800,NULL,(with R. Patterson)
225,13,6,3,3,NULL,C. Bajaj,The Algebraic Degree of Geometric Optimization Problems,"Discrete and Computational Geometry, 3, 1, (1988), 177-191.",Journal Publications,0,1988,"http://www.springerlink.com/(igmrlrblncy1mn55mninnnib)/app/home/contribution.asp?referrer=parent&backto=issue,14,28;journal,90,92;linkingpublicationresults,1:100356,1",http://cvcweb.ices.utexas.edu/cvc/papers/1988/journal/TR84-496.pdf,,"In this paper we apply Galois methods to certain fundamental geometric optimization problems whose 
exact computational complexity has been an open problem for a long time. In particular we show 
that the classic Weber problem, along with the line-restricted Weber problem and its three-
dimensional version are in general not solvable by radicals over the field of rationals. One 
direct consequence of these results is that for these geometric optimization problems there 
exists no exact algorithm under models of computation where the root of an algebraic 
equation is obtained using arithmetic operations and the extraction of k-th roots. This leaves 
only numerical or symbolic approximations to the solutions, where the complexity of the 
approximations is shown to be primarily a function of the algebraic degree of the optimum 
solution point.",11/22/2017 19:31,1000,NULL,NULL
226,6,6,6,6,NULL,"C. Bajaj, T. Moh",Generalized Unfoldings for Shortest Paths in Euclidean 3-Space,"International Journal of Robotics Research, 7, 1, (1988), 71-76.",Journal Publications,0,1988,,http://cvcweb.ices.utexas.edu/cvc/papers/1986/conference/TR85-526.pdf,,,12/4/2006 14:47,1000,NULL,(with T. Moh)
227,6,6,6,6,NULL,"C. Bajaj, M. Kim",Generation of Configuration Space Obstacles: The Case of Moving Spheres,"IEEE Journal of Robotics and Automation, 4, 1, (1988), 94-99.",Journal Publications,0,1988,http://ieeexplore.ieee.org/iel1/56/50/00000777.pdf?isnumber=50&prod=JNL&arnumber=777&arSt=94&ared=99&arAuthor=Bajaj%2C+C.%3B+Kim%2C+M.-S.,http://cvcweb.ices.utexas.edu/cvc/papers/1988/journal/00000777.pdf,,,12/4/2006 14:42,1000,NULL,(with M. Kim)
